{"schema": "acio.input/1", "request_id": "req-0011", "mode": "ask", "instruction": {"text": "Summarize the incident for the weekly report. Separate facts from interpretation."}, "workspace": {"root": "/work/shop", "access": "read_only"}, "materials": [{"id": "m1", "title": "Incident log", "text": "..."}, {"id": "m2", "title": "Postmortem draft", "text": "..."}], "task": {"type": "summarize", "effort": "medium", "evidence": "cite_sources", "uncertainty": true}}
