{"schema": "acio.input/1", "request_id": "req-0014", "mode": "task", "instruction": {"text": "Migrate the payment module to the new SDK.", "guidance_files": ["AGENTS.md", "docs/migration.md"]}, "workspace": {"root": "/work/shop", "access": "workspace_write", "paths": ["src/"]}, "task": {"type": "agentic", "effort": "high", "stop_conditions": ["a public API would change", "more than 30 files need edits"], "report": {"format": "markdown", "sections": ["changed files", "tests run", "open risks"]}}}
