{"schema": "acio.input/1", "request_id": "req-0010", "mode": "ask", "instruction": {"text": "Classify the ticket. Reply with the schema only.", "examples": [{"input": "Card was charged twice", "output": "{\"category\":\"billing\"}"}, {"input": "App crashes on login", "output": "{\"category\":\"bug\"}"}]}, "workspace": {"root": "/work/shop", "access": "read_only"}, "task": {"type": "extract", "effort": "low"}, "response_schema": {"type": "object", "required": ["category"], "properties": {"category": {"enum": ["billing", "bug", "other"]}}}}
