{"schema": "acio.input/1", "request_id": "req-0013", "mode": "task", "instruction": {"text": "Fix the rounding of the checkout total."}, "workspace": {"root": "/work/shop", "access": "workspace_write", "paths": ["src/"]}, "task": {"type": "code", "effort": "high", "completion": {"criteria": ["total rounds half up to cents", "no other file changes"], "verify": [["npm", "test", "--", "checkout"]]}}, "control": {"enabled": true, "decision_timeout_ms": 60000}}
