{"schema":"acio.input/1","request_id":"req-0001","mode":"ask","role":"coordinator","instruction":{"text":"Answer the operator's question about this project. Do not change any file.","language":"ko"},"conversation":[{"role":"operator","text":"How do I run it?"},{"role":"assistant","text":"Run npm start."},{"role":"operator","text":"And the tests?"}],"workspace":{"root":"/work/shop","access":"read_only"},"limits":{"timeout_ms":300000},"accept":{"versions":[1]}}
