{"schema": "acio.input/1", "request_id": "req-0012", "mode": "ask", "instruction": {"text": "Decide whether to roll back the release."}, "workspace": {"root": "/work/shop", "access": "read_only"}, "task": {"type": "analyze", "effort": "medium", "stop_conditions": ["error rate below 1% for 10 minutes", "data missing for more than one region"], "uncertainty": true}}
